{
  "id": "job_1",
  "operation": "text-to-image",
  "targetPanelId": "panel_1",
  "inputAssetIds": [],
  "provider": "local-vector",
  "model": "deterministic-vector-v1",
  "request": {
    "prompt": "A rainy rooftop",
    "parameters": {}
  },
  "status": "awaiting_review",
  "progress": {
    "done": 1,
    "total": 1
  },
  "error": null,
  "resultAssetIds": [
    "asset_1"
  ],
  "targetRevision": 1,
  "created": 0,
  "updated": 0,
  "provenance": {
    "provider": "local-vector",
    "model": "deterministic-vector-v1",
    "request": {
      "prompt": "A rainy rooftop"
    },
    "createdAt": 0
  }
}
